{"adapter_id":"chess-adapter-sha256:67c668f73996f05fa963fe88dd2405ad08c8f1cc19488b26883a27fab713a144","domain_gate":{"canonical_fen":"7k/5KQ1/8/8/8/8/8/8 b - - 0 1","decomposition":{"active_component_count":1,"conservative_one_ply_independence":{"decomposition_digest_sha256":null,"proof_kind":null,"status":"unavailable"},"digest_sha256":"1703c3afda9c9997329446bfcc02e73be06e1fcd12f5d18583a7b5b77aea2ccf","rejection_code":"no_locked_barrier","status":"rejected"},"domain_id":"formal_domain:first_constrained_chess:v0","immediate_terminal_tactic":null,"move_state_key":"7k/5KQ1/8/8/8/8/8/8 b - -","reasons":[],"status":"accepted","terminal_status":"checkmate"},"input":{"encoding":"fen","fen":"7k/5KQ1/8/8/8/8/8/8 b - - 0 1"},"native_adapter_version":"partizan.bounded_chess_adapter.native.v0.1","projection":{"domain_id":"formal_domain:bounded_chess_projection:v0","literal_game":{"left":[],"right":[]},"literal_game_sha256":"c154ede1a23233eac63f1093f3ff722319c7284e0237053335cea368e7110795","root_turn":"black","rule":"bounded_alternating_legal_move_normal_play_v1","statistics":{"checkmate_leaves":1,"duplicate_literal_options_removed":0,"horizon_leaves":0,"legal_edges":0,"literal_game_nodes":1,"max_depth_reached":0,"stalemate_leaves":0,"visited_position_nodes":1},"thermograph_identity":{"canonical_serialization":"GameTree(L[];R[])","digest_v1_sha256":"825af6fa4dc36203169c1cdc36c1053bffb059c7a53ecb9eeef3e337a273e90c","dyadic":null,"legacy_digest":"133c95ae473e6c1d","semantics":"structural_tree_identity_only","value_class":"game_tree"}},"refusal":null,"schema_version":"partizan.bounded_chess_adapter.v0.1","settings":{"max_plies":2,"node_budget":100},"status":"accepted","upstream_sources":{"astralbase":{"source_commit":"1ce02cfd3844ab1e5574be4e0c387f79784648bb","version":"0.1.0"},"bitmesh":{"source_commit":"b7c7858df2365d8ea4bd2f50ff2afbd51a6f8225","version":"0.1.0"},"thermograph":{"source_commit":"381e88dad1a1259a4ccc1a015537f8a8acaf7474","version":"0.1.0"}}}
